{"aliases":["Apple","苹果"],"brand_ids":[],"company_id":"co_apple_beijing","entity_status":"pending","industry":"消费电子","jurisdiction":"CN","legal_name":"苹果电子产品商贸（北京）有限公司","official_website_link_id":null,"public_identifier":"Apple 中国大陆销售政策所列主体；登记信息待复核","scopes":[{"city":"北京","city_code":"110100","claims":[{"checked_on":null,"claim_id":"cl_apple_rest_schedule","dimension":"rest_schedule","evidence_status":"unknown","rule_version":"cn-reference-v1","scope_id":"sc_apple_beijing","source_ids":[],"valid_from":null,"valid_until":null,"value":null},{"checked_on":null,"claim_id":"cl_apple_written_contract_policy","dimension":"written_contract_policy","evidence_status":"unknown","rule_version":"cn-reference-v1","scope_id":"sc_apple_beijing","source_ids":[],"valid_from":null,"valid_until":null,"value":null},{"checked_on":null,"claim_id":"cl_apple_working_hours_policy","dimension":"working_hours_policy","evidence_status":"unknown","rule_version":"cn-reference-v1","scope_id":"sc_apple_beijing","source_ids":[],"valid_from":null,"valid_until":null,"value":null},{"checked_on":null,"claim_id":"cl_apple_overtime_payment_practice","dimension":"overtime_payment_practice","evidence_status":"unknown","rule_version":"cn-reference-v1","scope_id":"sc_apple_beijing","source_ids":[],"valid_from":null,"valid_until":null,"value":null},{"checked_on":null,"claim_id":"cl_apple_salary_policy","dimension":"salary_policy","evidence_status":"unknown","rule_version":"cn-reference-v1","scope_id":"sc_apple_beijing","source_ids":[],"valid_from":null,"valid_until":null,"value":null},{"checked_on":null,"claim_id":"cl_apple_social_insurance_policy","dimension":"social_insurance_policy","evidence_status":"unknown","rule_version":"cn-reference-v1","scope_id":"sc_apple_beijing","source_ids":[],"valid_from":null,"valid_until":null,"value":null},{"checked_on":null,"claim_id":"cl_apple_annual_leave_policy","dimension":"annual_leave_policy","evidence_status":"unknown","rule_version":"cn-reference-v1","scope_id":"sc_apple_beijing","source_ids":[],"valid_from":null,"valid_until":null,"value":null}],"company_id":"co_apple_beijing","employment_type":"unknown","job_group":"岗位范围待确认","limitations":["本记录仅整理官方页面提及的中国大陆法律主体，不构成劳动友好推荐。","北京为主体名称所示地域，不代表已核实员工工作地点。","Apple 大中华区汇总数据、零售招聘说明与全球福利概述，不等于本法律主体及具体岗位的执行证明。","已核对中国报告和招聘原文；仍缺具体门店的劳动合同雇主、薪酬数字、社保缴费明细、年假天数及实际排班。","招聘页允许晚间、周末和公共节假日排班，不能标注为已核实周末双休。","不涵盖 Apple Inc.、其他关联公司、经销商、供应商或外包团队。"],"listing_state":"recheck_required","record_revision":2,"scope_id":"sc_apple_beijing","site_label":"具体工作场所待确认","work_time_regime":"special_regime_pending_review"}]}